{
  "analysis_id": "ANALYSIS-BAZI-020",
  "case_id": "CASE-BAZI-STANDARD-020",
  "computed_facts_sha256": "30aa1009c8f7c8fc2c2deed4bb84d5d835a3f8bb63d3d887e80874d5902fdc30",
  "data_classification": "synthetic",
  "reasoning_chain": [
    {
      "claim_id": "CLAIM-001",
      "fact_ids": [
        "bazi.pillar.hour"
      ],
      "rule_ids": [
        "BAZI-TIME-CIVIL-001"
      ],
      "section": "calculation_basis",
      "statement": "Calculation uses the supplied IANA civil time; true solar time is not applied."
    },
    {
      "claim_id": "CLAIM-002",
      "fact_ids": [
        "bazi.pillar.year"
      ],
      "rule_ids": [
        "BAZI-CAL-YEAR-001"
      ],
      "section": "verified_facts",
      "statement": "year pillar is 己未 under the selected policy."
    },
    {
      "claim_id": "CLAIM-003",
      "fact_ids": [
        "bazi.pillar.month"
      ],
      "rule_ids": [
        "BAZI-CAL-MONTH-001"
      ],
      "section": "verified_facts",
      "statement": "month pillar is 丙子 under the selected policy."
    },
    {
      "claim_id": "CLAIM-004",
      "fact_ids": [
        "bazi.pillar.day"
      ],
      "rule_ids": [
        "BAZI-CAL-DAY-001"
      ],
      "section": "verified_facts",
      "statement": "day pillar is 壬寅 under the selected policy."
    },
    {
      "claim_id": "CLAIM-005",
      "fact_ids": [
        "bazi.pillar.hour"
      ],
      "rule_ids": [
        "BAZI-CAL-HOUR-001"
      ],
      "section": "verified_facts",
      "statement": "hour pillar is 辛亥 under the selected policy."
    },
    {
      "claim_id": "CLAIM-006",
      "fact_ids": [
        "bazi.day_master"
      ],
      "rule_ids": [
        "BAZI-FACT-DAYMASTER-001"
      ],
      "section": "verified_facts",
      "statement": "Day master is 壬 (yang water)."
    },
    {
      "claim_id": "CLAIM-007",
      "fact_ids": [
        "bazi.ten_gods"
      ],
      "rule_ids": [
        "BAZI-FACT-TENGOD-001"
      ],
      "section": "symbolic_relationships",
      "statement": "Ten Gods are relational labels calculated from the day stem; no event claim is added."
    },
    {
      "claim_id": "CLAIM-008",
      "fact_ids": [
        "bazi.branch_relation.001"
      ],
      "rule_ids": [
        "BAZI-FACT-BRANCH-REL-001"
      ],
      "section": "symbolic_relationships",
      "statement": "Recorded branch relation harm connects year, month."
    },
    {
      "claim_id": "CLAIM-009",
      "fact_ids": [
        "bazi.branch_relation.002"
      ],
      "rule_ids": [
        "BAZI-FACT-BRANCH-REL-001"
      ],
      "section": "symbolic_relationships",
      "statement": "Recorded branch relation combine connects day, hour."
    },
    {
      "claim_id": "CLAIM-010",
      "fact_ids": [
        "bazi.branch_relation.003"
      ],
      "rule_ids": [
        "BAZI-FACT-BRANCH-REL-001"
      ],
      "section": "symbolic_relationships",
      "statement": "Recorded branch relation break connects day, hour."
    }
  ],
  "review": {
    "decision": null,
    "notes": "Machine-generated traceability candidate only. An independent named domain expert must verify or revise every claim before release.",
    "reviewed_at": null,
    "reviewer_id": null,
    "status": "pending_expert"
  },
  "strength_lineage": null
}
